<?xml version="1.0"?>
<!DOCTYPE Report
[
<!ELEMENT Report (General ,(Doc|BPT)) >
<!ATTLIST Report ver CDATA #REQUIRED tmZone CDATA #REQUIRED>

<!ELEMENT General ( DocLocation ) >
<!ATTLIST General productName CDATA #REQUIRED productVer CDATA #REQUIRED os CDATA #REQUIRED host CDATA #REQUIRED qcserver CDATA #IMPLIED qcproject CDATA #IMPLIED SolManSolutionId CDATA #IMPLIED SolManProjectId CDATA #IMPLIED SolManTestPlanId CDATA #IMPLIED SolManTestPackageId CDATA #IMPLIED SolManUserInfoData CDATA #IMPLIED  >

<!ELEMENT BPT (DName,Res,DVer?,TSet?,TInst?,NodeArgs,AdditionalInfo*,Doc*) >
<!ATTLIST BPT rID ID #REQUIRED >

<!ELEMENT Doc (DName,ConfName?,Res,DVer?,TSet?,TInst?,RunType?,DT?,AdditionalInfo*,Step*,DIter*,Step*,Action*,Doc*,Summary?,TestMaintenanceSummary*,NodeArgs?) >
<!ATTLIST Doc rID ID #REQUIRED type (Test|BC|BPTWrapperTest|Flow|Group|Action) "Test" productName CDATA #REQUIRED BCIter CDATA #IMPLIED >

<!ELEMENT RunType ( #PCDATA )>
<!ATTLIST RunType fmStep (False|True) "False" batch (False|True) "False" upDesc (False|True) "False" upChk (False|True) "False" upAS (False|True) "False">

<!ELEMENT DName ( #PCDATA ) >

<!ELEMENT ConfName ( #PCDATA ) >

<!ELEMENT Res ( #PCDATA ) >

<!ELEMENT AdditionalInfo (AdditionalDataName,AdditionalDataValue ) >

<!ELEMENT AdditionalDataName ( #PCDATA ) >

<!ELEMENT AdditionalDataValue ( #PCDATA ) >

<!ELEMENT DVer ( #PCDATA ) >

<!ELEMENT TSet ( #PCDATA ) >

<!ELEMENT TInst ( #PCDATA ) >

<!ELEMENT DIter (Step*,Action+,Summary?,NodeArgs)>
<!ATTLIST DIter rID ID #REQUIRED iterID CDATA #REQUIRED>

<!ELEMENT DocLocation ( #PCDATA )>

<!ELEMENT Action (AName,AIter*,(Step|HtmlStep|Action)*, Summary,ActionMaintenanceSummary*, NodeArgs ) >
<!ATTLIST Action rID ID #REQUIRED>

<!ELEMENT AIter ((Step|HtmlStep|Action)*,DataMapping?, Summary?,NodeArgs) >
<!ATTLIST AIter rID ID #REQUIRED iterID CDATA #REQUIRED isCountable (False|True) "False" >

<!ELEMENT AName ( #PCDATA ) >

<!ELEMENT TestMaintenanceSummary (ActionMaintenanceSummary*) >
<!ATTLIST TestMaintenanceSummary ObjectsAdded CDATA #REQUIRED ObjectsUpdated CDATA #REQUIRED StepsUpdated CDATA #REQUIRED StepsComments CDATA #REQUIRED><!ELEMENT ActionMaintenanceSummary (ObjectChange* ) >
<!ATTLIST ActionMaintenanceSummary Action CDATA #REQUIRED Objects CDATA #REQUIRED Updated CDATA #REQUIRED LinesTotal CDATA #REQUIRED Added CDATA #REQUIRED LinesUpdated CDATA #REQUIRED>

<!ELEMENT ObjectChange  (Hierarchy, PropertyChangeList* ) >
<!ATTLIST ObjectChange Operation CDATA #IMPLIED OriginalRepository CDATA #IMPLIED>

<!ELEMENT PropertyChangeList (PropertyDef*) >

<!ELEMENT PropertyDef (OriginalValue, NewValue) >
<!ATTLIST PropertyDef PropName CDATA #REQUIRED OriginRegularExpression (True|False) "False" NewRegularExpression (True|False) "False" AddedProperty (True|False) "False" >

<!ELEMENT OriginalValue ( #PCDATA )>

<!ELEMENT NewValue ( #PCDATA )>

<!ELEMENT Hierarchy  (ObjectName, Hierarchy*) >
<!ATTLIST Hierarchy MicClass CDATA #REQUIRED>

<!ELEMENT ObjectName  ( #PCDATA ) >

<!ELEMENT Step (Obj,Details,Time,TimeTick* ,(Step|HtmlStep|Doc)*, DataMapping?, NodeArgs) >
<!ATTLIST Step rID ID #REQUIRED retval CDATA #IMPLIED>

<!ELEMENT HtmlStep (HTML,TimeTick*,(Step|HtmlStep|Doc)*,NodeArgs) >
<!ATTLIST HtmlStep rID ID #REQUIRED >

<!ELEMENT Obj ( #PCDATA ) >
<!ATTLIST Obj plainTxt (False|True) "True">

<!ELEMENT Details ( #PCDATA ) >
<!ATTLIST Details plainTxt (False|True) "True">

<!ELEMENT Time ( #PCDATA ) >

<!ELEMENT HTML ( #PCDATA ) >

<!ELEMENT Disp ( #PCDATA ) >

<!ELEMENT TimeTick ( #PCDATA ) >

<!ELEMENT DataMapping ( DataMappedItem* )>
<!ELEMENT DataMappedItem EMPTY >
<!ATTLIST DataMappedItem dsName CDATA #REQUIRED >
<!ATTLIST DataMappedItem rowId CDATA #REQUIRED >

<!ELEMENT NodeArgs (Disp,TopPane?,BtmPane?,ExtendedInfo? )>
<!ATTLIST NodeArgs eType CDATA #REQUIRED icon CDATA #REQUIRED nRep CDATA #REQUIRED UserNote CDATA #IMPLIED filter (False|True) "True">
<!ATTLIST NodeArgs status (Passed|Failed|Done|Warning|Information) "Done">
<!ATTLIST NodeArgs iconSel CDATA #IMPLIED nType CDATA #IMPLIED MovieMarker CDATA "">
<!ATTLIST NodeArgs Source CDATA #IMPLIED SourceLine CDATA #IMPLIED StepFlowItemKey CDATA #IMPLIED >

<!ELEMENT TopPane (Path)>

<!ELEMENT BtmPane ( (Path|WR)?,ASHilite?)>
<!ATTLIST BtmPane vType CDATA "HTML">

<!ELEMENT Path ( #PCDATA ) >

<!ELEMENT ASHilite ( #PCDATA ) >

<!ELEMENT WR ( #PCDATA ) >

<!ELEMENT ExtendedInfo ( StepData ) >

<!ATTLIST ExtendedInfo StepType CDATA #REQUIRED>
<!ELEMENT DT (NodeArgs) >
<!ATTLIST DT rID ID #REQUIRED>

<!ELEMENT Summary (Param*)>
<!ATTLIST Summary sTime CDATA #IMPLIED eTime CDATA #IMPLIED passed CDATA #IMPLIED failed CDATA #IMPLIED warnings CDATA #IMPLIED retval CDATA #IMPLIED stopped (False|True) "False" >

<!ELEMENT Param (ParamName,ParamVal)+ >
<!ATTLIST Param paramInOut (In|Out) "In">

<!ELEMENT ParamName ( #PCDATA ) >

<!ELEMENT ParamVal ( #PCDATA ) >

]
>
<Report ver="2.0" tmZone="India Standard Time">
<General productName="HPE Unified Functional Testing" productVer="14.03" os="" host="LIN33004137"><DocLocation><![CDATA[C:\framework\QTP-Hybrid-Framework\QTP-Hybrid-Framework\TestCases\Place_Order]]></DocLocation></General>
<Doc rID="T1"   productName= "HPE Unified Functional Testing"  >
<DName><![CDATA[Place_Order]]></DName>
<Res><![CDATA[Res11]]></Res>
<DT rID="T2">
<NodeArgs eType="Table" icon="2" nRep="4" filter="False" >
<Disp><![CDATA[Run-Time Data Table]]></Disp>
<BtmPane vType="Table" >
<Path><![CDATA[Default.xls]]></Path>
</BtmPane>
</NodeArgs>
</DT>
<Step rID="T3">
<Obj plainTxt="False" ><![CDATA[Add-in(s) not activated]]></Obj>
<Details plainTxt="False" ><![CDATA[The following add-in(s) were associated with your test, but are not currently loaded: 
ActiveX, Silverlight, WinForms.]]></Details>
<Time><![CDATA[13-02-2023 - 16:22:17]]></Time>
<TimeTick>1676285537</TimeTick>
<NodeArgs eType="Replay" icon="0" nRep="5" status="Warning" >
<Disp><![CDATA[Add-in(s) not activated]]></Disp>
</NodeArgs>
</Step>
<DIter rID="T4" iterID="1" >
<Step rID="T5">
<Obj ><![CDATA[Replay Start]]></Obj>
<Details ><![CDATA[This run was performed on Internet Explorer without the required 'Enable third-party browser extension' option selected. Therefore, steps performed on this browser may have unexpected results.  It is recommended to select the 'Tools > Internet Options > Advanced > Enable third-party browser extensions' option in Internet Explorer and then run this test again.]]></Details>
<Time><![CDATA[13-02-2023 - 16:22:43]]></Time>
<TimeTick>1676285563</TimeTick>
<NodeArgs eType="User" icon="4" nRep="8" status="Failed" Source="Action0" SourceLine="-1" >
<Disp><![CDATA[Replay Start]]></Disp>
</NodeArgs>
</Step>
<Action rID="T6">
<AName><![CDATA[placeorder]]></AName>
<Step rID="T7">
<Obj plainTxt="False" ><![CDATA[SystemUtil]]></Obj>
<Details plainTxt="False" ><![CDATA[SystemUtil]]></Details>
<Time><![CDATA[13-02-2023 - 16:22:44]]></Time>
<TimeTick>1676285564</TimeTick>
<Step rID="T8">
<Obj plainTxt="False" ><![CDATA[Run "C:\Program Files\Google\Chrome\Application\chrome.exe",1]]></Obj>
<Details plainTxt="False" ><![CDATA[Run "C:\Program Files\Google\Chrome\Application\chrome.exe",1]]></Details>
<Time><![CDATA[13-02-2023 - 16:22:44]]></Time>
<TimeTick>1676285564</TimeTick>
<NodeArgs eType="Replay" icon="6" nRep="13" status="Passed" >
<Disp><![CDATA[Run "C:\Program Files\Google\Chrome\Application\chrome.exe",1]]></Disp>
</NodeArgs>
</Step>
<NodeArgs eType="Replay" icon="6" nRep="12" status="Passed" >
<Disp><![CDATA[SystemUtil]]></Disp>
</NodeArgs>
</Step>
<Step rID="T9">
<Obj plainTxt="False" ><![CDATA[[ Log in ].Click]]></Obj>
<Details plainTxt="False" ><![CDATA[]]></Details>
<Time><![CDATA[13-02-2023 - 16:23:03]]></Time>
<TimeTick>1676285583</TimeTick>
<NodeArgs eType="Replay" icon="7" nRep="71" >
<Disp><![CDATA[[ Log in ].Click]]></Disp>
</NodeArgs>
</Step>
<Step rID="T10">
<Obj ><![CDATA['[ Log in ] link' Clicked]]></Obj>
<Details ><![CDATA[Passed]]></Details>
<Time><![CDATA[13-02-2023 - 16:23:03]]></Time>
<TimeTick>1676285583</TimeTick>
<NodeArgs eType="User" icon="4" nRep="72" status="Passed" >
<Disp><![CDATA['[ Log in ] link' Clicked]]></Disp>
</NodeArgs>
</Step>
<Step rID="T11">
<Obj plainTxt="False" ><![CDATA[[ Email ].Exist]]></Obj>
<Details plainTxt="False" ><![CDATA["Object exists"]]></Details>
<Time><![CDATA[13-02-2023 - 16:23:05]]></Time>
<TimeTick>1676285585</TimeTick>
<NodeArgs eType="Replay" icon="8" nRep="74" >
<Disp><![CDATA[[ Email ].Exist]]></Disp>
</NodeArgs>
</Step>
<Step rID="T12">
<Obj ><![CDATA[Email field is available]]></Obj>
<Details ><![CDATA[PASSED]]></Details>
<Time><![CDATA[13-02-2023 - 16:23:05]]></Time>
<TimeTick>1676285585</TimeTick>
<NodeArgs eType="User" icon="4" nRep="75" status="Passed" >
<Disp><![CDATA[Email field is available]]></Disp>
</NodeArgs>
</Step>
<Step rID="T13">
<Obj plainTxt="False" ><![CDATA[[ Email ].Set]]></Obj>
<Details plainTxt="False" ><![CDATA["Rahman@Rahman.com"]]></Details>
<Time><![CDATA[13-02-2023 - 16:23:05]]></Time>
<TimeTick>1676285585</TimeTick>
<NodeArgs eType="Replay" icon="8" nRep="78" >
<Disp><![CDATA[[ Email ].Set]]></Disp>
</NodeArgs>
</Step>
<Step rID="T14">
<Obj ><![CDATA[Value - 'Rahman@Rahman.com' entered in Field - '[ Email ] edit box']]></Obj>
<Details ><![CDATA[Passed]]></Details>
<Time><![CDATA[13-02-2023 - 16:23:05]]></Time>
<TimeTick>1676285585</TimeTick>
<NodeArgs eType="User" icon="4" nRep="79" status="Passed" >
<Disp><![CDATA[Value - 'Rahman@Rahman.com' entered in Field - '[ Email ] edit box']]></Disp>
</NodeArgs>
</Step>
<Step rID="T15">
<Obj plainTxt="False" ><![CDATA[[ Password ].Exist]]></Obj>
<Details plainTxt="False" ><![CDATA["Object exists"]]></Details>
<Time><![CDATA[13-02-2023 - 16:23:05]]></Time>
<TimeTick>1676285585</TimeTick>
<NodeArgs eType="Replay" icon="8" nRep="81" >
<Disp><![CDATA[[ Password ].Exist]]></Disp>
</NodeArgs>
</Step>
<Step rID="T16">
<Obj ><![CDATA[Email field is available]]></Obj>
<Details ><![CDATA[PASSED]]></Details>
<Time><![CDATA[13-02-2023 - 16:23:06]]></Time>
<TimeTick>1676285586</TimeTick>
<NodeArgs eType="User" icon="4" nRep="82" status="Passed" >
<Disp><![CDATA[Email field is available]]></Disp>
</NodeArgs>
</Step>
<Step rID="T17">
<Obj plainTxt="False" ><![CDATA[[ Password ].Set]]></Obj>
<Details plainTxt="False" ><![CDATA["Rahman@12345"]]></Details>
<Time><![CDATA[13-02-2023 - 16:23:06]]></Time>
<TimeTick>1676285586</TimeTick>
<NodeArgs eType="Replay" icon="8" nRep="85" >
<Disp><![CDATA[[ Password ].Set]]></Disp>
</NodeArgs>
</Step>
<Step rID="T18">
<Obj ><![CDATA[Value - 'Rahman@12345' entered in Field - '[ Password ] edit box']]></Obj>
<Details ><![CDATA[Passed]]></Details>
<Time><![CDATA[13-02-2023 - 16:23:06]]></Time>
<TimeTick>1676285586</TimeTick>
<NodeArgs eType="User" icon="4" nRep="86" status="Passed" >
<Disp><![CDATA[Value - 'Rahman@12345' entered in Field - '[ Password ] edit box']]></Disp>
</NodeArgs>
</Step>
<Step rID="T19">
<Obj plainTxt="False" ><![CDATA[[ Log in ].Exist]]></Obj>
<Details plainTxt="False" ><![CDATA["Object exists"]]></Details>
<Time><![CDATA[13-02-2023 - 16:23:06]]></Time>
<TimeTick>1676285586</TimeTick>
<NodeArgs eType="Replay" icon="9" nRep="88" >
<Disp><![CDATA[[ Log in ].Exist]]></Disp>
</NodeArgs>
</Step>
<Step rID="T20">
<Obj ><![CDATA[Login button is avaiable]]></Obj>
<Details ><![CDATA[PASSED]]></Details>
<Time><![CDATA[13-02-2023 - 16:23:06]]></Time>
<TimeTick>1676285586</TimeTick>
<NodeArgs eType="User" icon="4" nRep="89" status="Passed" >
<Disp><![CDATA[Login button is avaiable]]></Disp>
</NodeArgs>
</Step>
<Step rID="T21">
<Obj plainTxt="False" ><![CDATA[[ Log in ].Click]]></Obj>
<Details plainTxt="False" ><![CDATA[]]></Details>
<Time><![CDATA[13-02-2023 - 16:23:06]]></Time>
<TimeTick>1676285586</TimeTick>
<NodeArgs eType="Replay" icon="9" nRep="92" >
<Disp><![CDATA[[ Log in ].Click]]></Disp>
</NodeArgs>
</Step>
<Step rID="T22">
<Obj ><![CDATA['[ Log in ] button' Clicked]]></Obj>
<Details ><![CDATA[Passed]]></Details>
<Time><![CDATA[13-02-2023 - 16:23:06]]></Time>
<TimeTick>1676285586</TimeTick>
<NodeArgs eType="User" icon="4" nRep="93" status="Passed" >
<Disp><![CDATA['[ Log in ] button' Clicked]]></Disp>
</NodeArgs>
</Step>
<Step rID="T23">
<Obj plainTxt="False" ><![CDATA[[ q ].Exist]]></Obj>
<Details plainTxt="False" ><![CDATA["Object exists"]]></Details>
<Time><![CDATA[13-02-2023 - 16:23:08]]></Time>
<TimeTick>1676285588</TimeTick>
<NodeArgs eType="Replay" icon="8" nRep="95" >
<Disp><![CDATA[[ q ].Exist]]></Disp>
</NodeArgs>
</Step>
<Step rID="T24">
<Obj ><![CDATA[Search box is avaialable]]></Obj>
<Details ><![CDATA[PASSED]]></Details>
<Time><![CDATA[13-02-2023 - 16:23:08]]></Time>
<TimeTick>1676285588</TimeTick>
<NodeArgs eType="User" icon="4" nRep="96" status="Passed" >
<Disp><![CDATA[Search box is avaialable]]></Disp>
</NodeArgs>
</Step>
<Step rID="T25">
<Obj plainTxt="False" ><![CDATA[[ q ].Set]]></Obj>
<Details plainTxt="False" ><![CDATA["computer"]]></Details>
<Time><![CDATA[13-02-2023 - 16:23:09]]></Time>
<TimeTick>1676285589</TimeTick>
<NodeArgs eType="Replay" icon="8" nRep="99" >
<Disp><![CDATA[[ q ].Set]]></Disp>
</NodeArgs>
</Step>
<Step rID="T26">
<Obj ><![CDATA[Value - 'computer' entered in Field - '[ q ] edit box']]></Obj>
<Details ><![CDATA[Passed]]></Details>
<Time><![CDATA[13-02-2023 - 16:23:09]]></Time>
<TimeTick>1676285589</TimeTick>
<NodeArgs eType="User" icon="4" nRep="100" status="Passed" >
<Disp><![CDATA[Value - 'computer' entered in Field - '[ q ] edit box']]></Disp>
</NodeArgs>
</Step>
<Step rID="T27">
<Obj plainTxt="False" ><![CDATA[[ Search ].Exist]]></Obj>
<Details plainTxt="False" ><![CDATA["Object exists"]]></Details>
<Time><![CDATA[13-02-2023 - 16:23:09]]></Time>
<TimeTick>1676285589</TimeTick>
<NodeArgs eType="Replay" icon="9" nRep="102" >
<Disp><![CDATA[[ Search ].Exist]]></Disp>
</NodeArgs>
</Step>
<Step rID="T28">
<Obj ><![CDATA[Search Button is available]]></Obj>
<Details ><![CDATA[PASSED]]></Details>
<Time><![CDATA[13-02-2023 - 16:23:09]]></Time>
<TimeTick>1676285589</TimeTick>
<NodeArgs eType="User" icon="4" nRep="103" status="Passed" >
<Disp><![CDATA[Search Button is available]]></Disp>
</NodeArgs>
</Step>
<Step rID="T29">
<Obj plainTxt="False" ><![CDATA[[ Search ].Click]]></Obj>
<Details plainTxt="False" ><![CDATA[]]></Details>
<Time><![CDATA[13-02-2023 - 16:23:09]]></Time>
<TimeTick>1676285589</TimeTick>
<NodeArgs eType="Replay" icon="9" nRep="106" >
<Disp><![CDATA[[ Search ].Click]]></Disp>
</NodeArgs>
</Step>
<Step rID="T30">
<Obj ><![CDATA['[ Search ] button' Clicked]]></Obj>
<Details ><![CDATA[Passed]]></Details>
<Time><![CDATA[13-02-2023 - 16:23:09]]></Time>
<TimeTick>1676285589</TimeTick>
<NodeArgs eType="User" icon="4" nRep="107" status="Passed" >
<Disp><![CDATA['[ Search ] button' Clicked]]></Disp>
</NodeArgs>
</Step>
<Step rID="T31">
<Obj plainTxt="False" ><![CDATA[[ Build your own cheap computer ].Exist]]></Obj>
<Details plainTxt="False" ><![CDATA["Object exists"]]></Details>
<Time><![CDATA[13-02-2023 - 16:23:11]]></Time>
<TimeTick>1676285591</TimeTick>
<NodeArgs eType="Replay" icon="7" nRep="109" >
<Disp><![CDATA[[ Build your own cheap computer ].Exist]]></Disp>
</NodeArgs>
</Step>
<Step rID="T32">
<Obj ><![CDATA[Build cheap computer link is available]]></Obj>
<Details ><![CDATA[PASSED]]></Details>
<Time><![CDATA[13-02-2023 - 16:23:11]]></Time>
<TimeTick>1676285591</TimeTick>
<NodeArgs eType="User" icon="4" nRep="110" status="Passed" >
<Disp><![CDATA[Build cheap computer link is available]]></Disp>
</NodeArgs>
</Step>
<Step rID="T33">
<Obj plainTxt="False" ><![CDATA[[ Build your own cheap computer ].Click]]></Obj>
<Details plainTxt="False" ><![CDATA[]]></Details>
<Time><![CDATA[13-02-2023 - 16:23:11]]></Time>
<TimeTick>1676285591</TimeTick>
<NodeArgs eType="Replay" icon="7" nRep="113" >
<Disp><![CDATA[[ Build your own cheap computer ].Click]]></Disp>
</NodeArgs>
</Step>
<Step rID="T34">
<Obj ><![CDATA['[ Build your own cheap computer ] link' Clicked]]></Obj>
<Details ><![CDATA[Passed]]></Details>
<Time><![CDATA[13-02-2023 - 16:23:11]]></Time>
<TimeTick>1676285591</TimeTick>
<NodeArgs eType="User" icon="4" nRep="114" status="Passed" >
<Disp><![CDATA['[ Build your own cheap computer ] link' Clicked]]></Disp>
</NodeArgs>
</Step>
<Step rID="T35">
<Obj plainTxt="False" ><![CDATA[[ product_attribute_72_5_18 ].Exist]]></Obj>
<Details plainTxt="False" ><![CDATA["Object exists"]]></Details>
<Time><![CDATA[13-02-2023 - 16:23:16]]></Time>
<TimeTick>1676285596</TimeTick>
<NodeArgs eType="Replay" icon="10" nRep="116" >
<Disp><![CDATA[[ product_attribute_72_5_18 ].Exist]]></Disp>
</NodeArgs>
</Step>
<Step rID="T36">
<Obj ><![CDATA[Processor Radio group is available]]></Obj>
<Details ><![CDATA[PASSED]]></Details>
<Time><![CDATA[13-02-2023 - 16:23:16]]></Time>
<TimeTick>1676285596</TimeTick>
<NodeArgs eType="User" icon="4" nRep="117" status="Passed" >
<Disp><![CDATA[Processor Radio group is available]]></Disp>
</NodeArgs>
</Step>
<Step rID="T37">
<Obj plainTxt="False" ><![CDATA[[ product_attribute_72_5_18 ].Select]]></Obj>
<Details plainTxt="False" ><![CDATA["52"]]></Details>
<Time><![CDATA[13-02-2023 - 16:23:16]]></Time>
<TimeTick>1676285596</TimeTick>
<NodeArgs eType="Replay" icon="10" nRep="120" >
<Disp><![CDATA[[ product_attribute_72_5_18 ].Select]]></Disp>
</NodeArgs>
</Step>
<Step rID="T38">
<Obj ><![CDATA[Value - '52' selected from Drop Down Field - '[ product_attribute_72_5_18 ] radio button group']]></Obj>
<Details ><![CDATA[Passed]]></Details>
<Time><![CDATA[13-02-2023 - 16:23:16]]></Time>
<TimeTick>1676285596</TimeTick>
<NodeArgs eType="User" icon="4" nRep="121" status="Passed" >
<Disp><![CDATA[Value - '52' selected from Drop Down Field - '[ product_attribute_72_5_18 ] radio button group']]></Disp>
</NodeArgs>
</Step>
<Step rID="T39">
<Obj plainTxt="False" ><![CDATA[[ product_attribute_72_6_19 ].Exist]]></Obj>
<Details plainTxt="False" ><![CDATA["Object exists"]]></Details>
<Time><![CDATA[13-02-2023 - 16:23:16]]></Time>
<TimeTick>1676285596</TimeTick>
<NodeArgs eType="Replay" icon="10" nRep="123" >
<Disp><![CDATA[[ product_attribute_72_6_19 ].Exist]]></Disp>
</NodeArgs>
</Step>
<Step rID="T40">
<Obj ><![CDATA[RAM Radio group is available]]></Obj>
<Details ><![CDATA[PASSED]]></Details>
<Time><![CDATA[13-02-2023 - 16:23:16]]></Time>
<TimeTick>1676285596</TimeTick>
<NodeArgs eType="User" icon="4" nRep="124" status="Passed" >
<Disp><![CDATA[RAM Radio group is available]]></Disp>
</NodeArgs>
</Step>
<Step rID="T41">
<Obj plainTxt="False" ><![CDATA[[ product_attribute_72_6_19 ].Select]]></Obj>
<Details plainTxt="False" ><![CDATA["55"]]></Details>
<Time><![CDATA[13-02-2023 - 16:23:16]]></Time>
<TimeTick>1676285596</TimeTick>
<NodeArgs eType="Replay" icon="10" nRep="127" >
<Disp><![CDATA[[ product_attribute_72_6_19 ].Select]]></Disp>
</NodeArgs>
</Step>
<Step rID="T42">
<Obj ><![CDATA[Value - '55' selected from Drop Down Field - '[ product_attribute_72_6_19 ] radio button group']]></Obj>
<Details ><![CDATA[Passed]]></Details>
<Time><![CDATA[13-02-2023 - 16:23:16]]></Time>
<TimeTick>1676285596</TimeTick>
<NodeArgs eType="User" icon="4" nRep="128" status="Passed" >
<Disp><![CDATA[Value - '55' selected from Drop Down Field - '[ product_attribute_72_6_19 ] radio button group']]></Disp>
</NodeArgs>
</Step>
<Step rID="T43">
<Obj plainTxt="False" ><![CDATA[[ product_attribute_72_3_20 ].Exist]]></Obj>
<Details plainTxt="False" ><![CDATA["Object exists"]]></Details>
<Time><![CDATA[13-02-2023 - 16:23:16]]></Time>
<TimeTick>1676285596</TimeTick>
<NodeArgs eType="Replay" icon="10" nRep="130" >
<Disp><![CDATA[[ product_attribute_72_3_20 ].Exist]]></Disp>
</NodeArgs>
</Step>
<Step rID="T44">
<Obj ><![CDATA[RAM Radio group is available]]></Obj>
<Details ><![CDATA[PASSED]]></Details>
<Time><![CDATA[13-02-2023 - 16:23:16]]></Time>
<TimeTick>1676285596</TimeTick>
<NodeArgs eType="User" icon="4" nRep="131" status="Passed" >
<Disp><![CDATA[RAM Radio group is available]]></Disp>
</NodeArgs>
</Step>
<Step rID="T45">
<Obj plainTxt="False" ><![CDATA[[ product_attribute_72_3_20 ].Select]]></Obj>
<Details plainTxt="False" ><![CDATA["58"]]></Details>
<Time><![CDATA[13-02-2023 - 16:23:17]]></Time>
<TimeTick>1676285597</TimeTick>
<NodeArgs eType="Replay" icon="10" nRep="134" >
<Disp><![CDATA[[ product_attribute_72_3_20 ].Select]]></Disp>
</NodeArgs>
</Step>
<Step rID="T46">
<Obj ><![CDATA[Value - '58' selected from Drop Down Field - '[ product_attribute_72_3_20 ] radio button group']]></Obj>
<Details ><![CDATA[Passed]]></Details>
<Time><![CDATA[13-02-2023 - 16:23:17]]></Time>
<TimeTick>1676285597</TimeTick>
<NodeArgs eType="User" icon="4" nRep="135" status="Passed" >
<Disp><![CDATA[Value - '58' selected from Drop Down Field - '[ product_attribute_72_3_20 ] radio button group']]></Disp>
</NodeArgs>
</Step>
<Step rID="T47">
<Obj plainTxt="False" ><![CDATA[[ product_attribute_72_8_30 ].Exist]]></Obj>
<Details plainTxt="False" ><![CDATA["Object exists"]]></Details>
<Time><![CDATA[13-02-2023 - 16:23:17]]></Time>
<TimeTick>1676285597</TimeTick>
<NodeArgs eType="Replay" icon="11" nRep="137" >
<Disp><![CDATA[[ product_attribute_72_8_30 ].Exist]]></Disp>
</NodeArgs>
</Step>
<Step rID="T48">
<Obj ><![CDATA[Office Suite CheckBox Exist]]></Obj>
<Details ><![CDATA[PASSED]]></Details>
<Time><![CDATA[13-02-2023 - 16:23:17]]></Time>
<TimeTick>1676285597</TimeTick>
<NodeArgs eType="User" icon="4" nRep="138" status="Passed" >
<Disp><![CDATA[Office Suite CheckBox Exist]]></Disp>
</NodeArgs>
</Step>
<Step rID="T49">
<Obj plainTxt="False" ><![CDATA[[ product_attribute_72_8_30 ].Set]]></Obj>
<Details plainTxt="False" ><![CDATA["ON"]]></Details>
<Time><![CDATA[13-02-2023 - 16:23:17]]></Time>
<TimeTick>1676285597</TimeTick>
<NodeArgs eType="Replay" icon="11" nRep="141" >
<Disp><![CDATA[[ product_attribute_72_8_30 ].Set]]></Disp>
</NodeArgs>
</Step>
<Step rID="T50">
<Obj ><![CDATA['[ product_attribute_72_8_30 ] check box' Clicked]]></Obj>
<Details ><![CDATA[Passed]]></Details>
<Time><![CDATA[13-02-2023 - 16:23:17]]></Time>
<TimeTick>1676285597</TimeTick>
<NodeArgs eType="User" icon="4" nRep="142" status="Passed" >
<Disp><![CDATA['[ product_attribute_72_8_30 ] check box' Clicked]]></Disp>
</NodeArgs>
</Step>
<Step rID="T51">
<Obj plainTxt="False" ><![CDATA[[ addtocart_72.EnteredQuantity ].Exist]]></Obj>
<Details plainTxt="False" ><![CDATA["Object exists"]]></Details>
<Time><![CDATA[13-02-2023 - 16:23:17]]></Time>
<TimeTick>1676285597</TimeTick>
<NodeArgs eType="Replay" icon="8" nRep="144" >
<Disp><![CDATA[[ addtocart_72.EnteredQuantity ].Exist]]></Disp>
</NodeArgs>
</Step>
<Step rID="T52">
<Obj ><![CDATA[Quantity field is available]]></Obj>
<Details ><![CDATA[PASSED]]></Details>
<Time><![CDATA[13-02-2023 - 16:23:17]]></Time>
<TimeTick>1676285597</TimeTick>
<NodeArgs eType="User" icon="4" nRep="145" status="Passed" >
<Disp><![CDATA[Quantity field is available]]></Disp>
</NodeArgs>
</Step>
<Step rID="T53">
<Obj plainTxt="False" ><![CDATA[[ addtocart_72.EnteredQuantity ]]]></Obj>
<Details plainTxt="False" ><![CDATA[WebEdit]]></Details>
<Time><![CDATA[13-02-2023 - 16:23:17]]></Time>
<TimeTick>1676285597</TimeTick>
<Step rID="T54">
<Obj plainTxt="False" ><![CDATA["[ addtocart_72.EnteredQuantity ]"]]></Obj>
<Details plainTxt="False" ><![CDATA[Property &quot;type&quot; has the expected value: &quot;text&quot;.]]></Details>
<Time><![CDATA[13-02-2023 - 16:23:17]]></Time>
<TimeTick>1676285597</TimeTick>
<NodeArgs eType="Replay" icon="8" nRep="148" status="Passed" nType="CheckProperty" >
<Disp><![CDATA["[ addtocart_72.EnteredQuantity ]"]]></Disp>
</NodeArgs>
</Step>
<NodeArgs eType="Context" icon="8" nRep="147" status="Passed" >
<Disp><![CDATA[[ addtocart_72.EnteredQuantity ]]]></Disp>
</NodeArgs>
</Step>
<Step rID="T55">
<Obj plainTxt="False" ><![CDATA[[ addtocart_72.EnteredQuantity ]]]></Obj>
<Details plainTxt="False" ><![CDATA[WebEdit]]></Details>
<Time><![CDATA[13-02-2023 - 16:23:17]]></Time>
<TimeTick>1676285597</TimeTick>
<Step rID="T56">
<Obj plainTxt="False" ><![CDATA["[ addtocart_72.EnteredQuantity ]"]]></Obj>
<Details plainTxt="False" ><![CDATA[Property &quot;value&quot; has the expected value: 1.]]></Details>
<Time><![CDATA[13-02-2023 - 16:23:17]]></Time>
<TimeTick>1676285597</TimeTick>
<NodeArgs eType="Replay" icon="8" nRep="151" status="Passed" nType="CheckProperty" >
<Disp><![CDATA["[ addtocart_72.EnteredQuantity ]"]]></Disp>
</NodeArgs>
</Step>
<NodeArgs eType="Context" icon="8" nRep="150" status="Passed" >
<Disp><![CDATA[[ addtocart_72.EnteredQuantity ]]]></Disp>
</NodeArgs>
</Step>
<Step rID="T57">
<Obj plainTxt="False" ><![CDATA[[ addtocart_72.EnteredQuantity ]]]></Obj>
<Details plainTxt="False" ><![CDATA[WebEdit]]></Details>
<Time><![CDATA[13-02-2023 - 16:23:17]]></Time>
<TimeTick>1676285597</TimeTick>
<Step rID="T58">
<Obj plainTxt="False" ><![CDATA["[ addtocart_72.EnteredQuantity ]"]]></Obj>
<Details plainTxt="False" ><![CDATA[Property &quot;visible&quot; has the expected value: True.]]></Details>
<Time><![CDATA[13-02-2023 - 16:23:17]]></Time>
<TimeTick>1676285597</TimeTick>
<NodeArgs eType="Replay" icon="8" nRep="154" status="Passed" nType="CheckProperty" >
<Disp><![CDATA["[ addtocart_72.EnteredQuantity ]"]]></Disp>
</NodeArgs>
</Step>
<NodeArgs eType="Context" icon="8" nRep="153" status="Passed" >
<Disp><![CDATA[[ addtocart_72.EnteredQuantity ]]]></Disp>
</NodeArgs>
</Step>
<Step rID="T59">
<Obj plainTxt="False" ><![CDATA[[ addtocart_72.EnteredQuantity ]]]></Obj>
<Details plainTxt="False" ><![CDATA[WebEdit]]></Details>
<Time><![CDATA[13-02-2023 - 16:23:17]]></Time>
<TimeTick>1676285597</TimeTick>
<Step rID="T60">
<Obj plainTxt="False" ><![CDATA["[ addtocart_72.EnteredQuantity ]"]]></Obj>
<Details plainTxt="False" ><![CDATA[Property &quot;kind&quot; has the expected value: &quot;singleline&quot;.]]></Details>
<Time><![CDATA[13-02-2023 - 16:23:17]]></Time>
<TimeTick>1676285597</TimeTick>
<NodeArgs eType="Replay" icon="8" nRep="157" status="Passed" nType="CheckProperty" >
<Disp><![CDATA["[ addtocart_72.EnteredQuantity ]"]]></Disp>
</NodeArgs>
</Step>
<NodeArgs eType="Context" icon="8" nRep="156" status="Passed" >
<Disp><![CDATA[[ addtocart_72.EnteredQuantity ]]]></Disp>
</NodeArgs>
</Step>
<Step rID="T61">
<Obj plainTxt="False" ><![CDATA[[ addtocart_72.EnteredQuantity ].Set]]></Obj>
<Details plainTxt="False" ><![CDATA["1"]]></Details>
<Time><![CDATA[13-02-2023 - 16:23:17]]></Time>
<TimeTick>1676285597</TimeTick>
<NodeArgs eType="Replay" icon="8" nRep="160" >
<Disp><![CDATA[[ addtocart_72.EnteredQuantity ].Set]]></Disp>
</NodeArgs>
</Step>
<Step rID="T62">
<Obj ><![CDATA[Value - '1' entered in Field - '[ addtocart_72.EnteredQuantity ] edit box']]></Obj>
<Details ><![CDATA[Passed]]></Details>
<Time><![CDATA[13-02-2023 - 16:23:17]]></Time>
<TimeTick>1676285597</TimeTick>
<NodeArgs eType="User" icon="4" nRep="161" status="Passed" >
<Disp><![CDATA[Value - '1' entered in Field - '[ addtocart_72.EnteredQuantity ] edit box']]></Disp>
</NodeArgs>
</Step>
<Step rID="T63">
<Obj plainTxt="False" ><![CDATA[[ 800.00  ].Exist]]></Obj>
<Details plainTxt="False" ><![CDATA["Object exists"]]></Details>
<Time><![CDATA[13-02-2023 - 16:23:18]]></Time>
<TimeTick>1676285598</TimeTick>
<NodeArgs eType="Replay" icon="12" nRep="163" >
<Disp><![CDATA[[ 800.00  ].Exist]]></Disp>
</NodeArgs>
</Step>
<Step rID="T64">
<Obj ><![CDATA[Price is displayed]]></Obj>
<Details ><![CDATA[PASSED]]></Details>
<Time><![CDATA[13-02-2023 - 16:23:18]]></Time>
<TimeTick>1676285598</TimeTick>
<NodeArgs eType="User" icon="4" nRep="164" status="Passed" >
<Disp><![CDATA[Price is displayed]]></Disp>
</NodeArgs>
</Step>
<Step rID="T65">
<Obj plainTxt="False" ><![CDATA[[ Add to cart ].Exist]]></Obj>
<Details plainTxt="False" ><![CDATA["Object exists"]]></Details>
<Time><![CDATA[13-02-2023 - 16:23:18]]></Time>
<TimeTick>1676285598</TimeTick>
<NodeArgs eType="Replay" icon="9" nRep="167" >
<Disp><![CDATA[[ Add to cart ].Exist]]></Disp>
</NodeArgs>
</Step>
<Step rID="T66">
<Obj ><![CDATA[Add to cart button is available]]></Obj>
<Details ><![CDATA[PASSED]]></Details>
<Time><![CDATA[13-02-2023 - 16:23:18]]></Time>
<TimeTick>1676285598</TimeTick>
<NodeArgs eType="User" icon="4" nRep="168" status="Passed" >
<Disp><![CDATA[Add to cart button is available]]></Disp>
</NodeArgs>
</Step>
<Step rID="T67">
<Obj plainTxt="False" ><![CDATA[[ Add to cart ]]]></Obj>
<Details plainTxt="False" ><![CDATA[WebButton]]></Details>
<Time><![CDATA[13-02-2023 - 16:23:18]]></Time>
<TimeTick>1676285598</TimeTick>
<Step rID="T68">
<Obj plainTxt="False" ><![CDATA["[ Add to cart ]"]]></Obj>
<Details plainTxt="False" ><![CDATA[Property &quot;type&quot; has the expected value: &quot;button&quot;.]]></Details>
<Time><![CDATA[13-02-2023 - 16:23:18]]></Time>
<TimeTick>1676285598</TimeTick>
<NodeArgs eType="Replay" icon="9" nRep="171" status="Passed" nType="CheckProperty" >
<Disp><![CDATA["[ Add to cart ]"]]></Disp>
</NodeArgs>
</Step>
<NodeArgs eType="Context" icon="9" nRep="170" status="Passed" >
<Disp><![CDATA[[ Add to cart ]]]></Disp>
</NodeArgs>
</Step>
<Step rID="T69">
<Obj plainTxt="False" ><![CDATA[[ Add to cart ]]]></Obj>
<Details plainTxt="False" ><![CDATA[WebButton]]></Details>
<Time><![CDATA[13-02-2023 - 16:23:18]]></Time>
<TimeTick>1676285598</TimeTick>
<Step rID="T70">
<Obj plainTxt="False" ><![CDATA["[ Add to cart ]"]]></Obj>
<Details plainTxt="False" ><![CDATA[Property &quot;value&quot; has the expected value: &quot;Add to cart&quot;.]]></Details>
<Time><![CDATA[13-02-2023 - 16:23:18]]></Time>
<TimeTick>1676285598</TimeTick>
<NodeArgs eType="Replay" icon="9" nRep="174" status="Passed" nType="CheckProperty" >
<Disp><![CDATA["[ Add to cart ]"]]></Disp>
</NodeArgs>
</Step>
<NodeArgs eType="Context" icon="9" nRep="173" status="Passed" >
<Disp><![CDATA[[ Add to cart ]]]></Disp>
</NodeArgs>
</Step>
<Step rID="T71">
<Obj plainTxt="False" ><![CDATA[[ Add to cart ]]]></Obj>
<Details plainTxt="False" ><![CDATA[WebButton]]></Details>
<Time><![CDATA[13-02-2023 - 16:23:18]]></Time>
<TimeTick>1676285598</TimeTick>
<Step rID="T72">
<Obj plainTxt="False" ><![CDATA["[ Add to cart ]"]]></Obj>